city,名称,id,纬度,经度,评价分数,介绍,封面图片
香港,宝云道健身径,1700091,22.268337,114.178972,4.0,宝云道位于半山腰，连接香港岛半山区至黄泥涌峡一带，此道环境宜人，两侧树木茂盛，而且不通汽车，因此辟作为健身步道，常有附近居民来此跑步健身。 宝云道沿途也建有不同之健身器具供不同人士健身用。,https://dimg04.c-ctrip.com/images/0103912000a2p8oszF7B6.jpg
香港,摩罗街,1700092,22.282184,114.154683,3.5,摩罗上街平行于皇后大道中与荷里活道的中间，是一条有名的古董街和杂货市场。这条长仅二百米的街巷中开有三十多家古董店，可以淘到各种玉器、陶瓷、铜佛、书画、木器等古董器件，也能淘到一些如旧表、旧钢笔、旧电话、芭比娃娃等老旧小玩意儿。,https://dimg04.c-ctrip.com/images/10010d0000006u4167171.jpg
香港,香港中文大学文物馆,1711476,22.416507,114.211102,4.4,香港中文大学文物馆位于香港中文大学本部中央校区，在富有浓厚人文气息的大学校园中欣赏文物馆里的中国艺术及文化展品，你会对中国源远流长的文化艺术有另一番体会。文物馆致力于收藏、保存、研究及展览中国文物如绘画、书法及不同类型的工艺美术，并经常举办不同专题的文物艺术及考古展览。,https://dimg04.c-ctrip.com/images/0105k12000b01g3kz0C0D.jpg
香港,宝灵街,1700099,22.301515,114.174833,4.0,宝灵街是位于佐敦的一条小街，它东达佐敦地铁站，西至广东道，全长不过370米。宝灵街上主要有一些卖各式小商品的小店，还有专门定制中式旗袍、花鞋、手袋的商店，晚上灯火通明，十分热闹。这里还是2007年上映的电影《门徒》的取景地，主演吴彦祖、古天乐和张静初曾在这里拍摄过很多镜头。,https://dimg04.c-ctrip.com/images/0103x12000bbx2kcj2C0D.jpg
香港,洋紫荆维港游,2132008,22.29178,114.205646,4.1,“洋紫荆维港游”游船从九龙红磡轮渡码头或北角码头出发，开船时间有17:45、19:30和20:00三种可供选，全程约1个半小时至2个小时时间。置身于华丽舒适的观光客轮中，一边欣赏醉人的海边日落以及维港夜景，一边品尝各国的美馔佳肴，现场还有优雅动听的乐队伴奏，情调十足，是与家人朋友一同观赏香港夜景的上佳之选。,https://dimg04.c-ctrip.com/images/1lo5z12000ksgk0um5C90.jpg
香港,前水警总部大楼及马厩,2730521,22.29249,114.174991,4.5,前水警总部大楼建成于一八八四年，包括主楼、马厩和报时塔；修复后成为了“1881 Heritage”，里面有与这座建筑相关的展览。,https://dimg04.c-ctrip.com/images/0103i12000f6r0769A104.jpg
香港,香港医学博物馆,1700107,22.280786,114.153674,4.4,香港医学博物馆位于香港岛中西区，馆内主要以文献与实物展品介绍香港医学发展史。博物馆所在的建筑是一栋英国爱德华式建筑物，由香港建筑师设计建造。,https://dimg04.c-ctrip.com/images/10080h000000929s383D5.jpg
香港,黄泥涌峡径,1711046,22.254523,114.198311,3.0,黄泥涌峡径位于大潭水塘道一带，途中经过10多个具有历史意义的站点，记录了1941年12月19日的黄泥涌峡战事。顺着路牌前行，一边饱览沿途自然风光，一边追思昔日战争实况，追寻珍贵的历史遗迹，十分具有教育意义。,https://dimg04.c-ctrip.com/images/0ww1u12000chi5gw32190.jpg
香港,荔枝角公园,2126852,22.332319,114.142426,4.4,荔枝角公园内经常会举行不同主题的花卉展览。公园内还有一处蓝白色尖顶小屋可去打卡拍照。,https://dimg04.c-ctrip.com/images/01023120009i3klk2F052.jpg
香港,雷霆节拍,2857140,22.232265,114.176185,4.5,,https://dimg04.c-ctrip.com/images/0106912000cdcrf35664D.jpg
香港,【中国香港】迪士尼飞天巡游,4722341,22.310155,114.047817,4.6,迪士尼飞天巡游是迪士尼乐园里的一项游玩项目，会出现各种各样的迪士尼人物，它们还会和观众进行互动，现场特别热闹。,https://dimg04.c-ctrip.com/images/0102s12000bbj5uw93DF4.jpg
香港,新九龙广场,4611708,22.317095,114.167529,4.3,新九龙广场为香港油尖旺区中型商场之一，广场设多个无障碍设施，包括出入口、升降机、通道和畅通易达洗手间等。,https://dimg04.c-ctrip.com/images/0105u12000bd9wrntD3AE.jpg
香港,伯大尼小教堂,1707436,22.25944,114.140412,3.5,伯大尼教堂位于薄扶林，采歌德式教堂建筑设计，是一座法国建筑风格的教堂，教堂周围绿意盎然，米白色的外墙透出来的和谐光芒，乍看下还以为身处欧洲，诚然庄严高贵。,https://dimg04.c-ctrip.com/images/100b0d0000006u3mi3D63.jpg
香港,尖东广场,4611600,22.296605,114.181655,4.4,,https://dimg04.c-ctrip.com/images/0102z12000bdmcobsA0D7.jpg
香港,太空飞碟,2698958,22.310951,114.046876,4.7,,https://dimg04.c-ctrip.com/images/0HJ5z12000htohe448A31.jpg
香港,芦须城泳滩,2526357,22.201772,114.127749,4.0,芦须城泳滩设施完善，绿树成荫，环境清幽，夏天海面设有浮台。,https://dimg04.c-ctrip.com/images/0106a12000bdgo7t6B91F.jpg
香港,南山邨,5073338,22.330039,114.175239,3.5,南山邨已有几十年的历史，南山邨的一大片空地上，有着旧式的圆拱攀爬架，同时三面都被密密麻麻的大厦包围，凭着强烈对比的视觉效果，成为打卡热门地点。,https://dimg04.c-ctrip.com/images/100vsa1439jzl58r4139A.jpg
香港,薄扶林村,1694113,22.257473,114.14191,4.0,"薄扶林村位于香港岛西部的薄扶林，是一个拥有三百多年历史的乡村，这里是香港岛硕果仅存的两个村落之一，而今面对众多挑战，依旧守护着她独有的历史和文化。
薄扶林村有着自己独特的信仰——李灵仙姐，并建有5米高的李灵仙姐塔，这座塔被环绕在层层叠叠的房屋中，每年农历四月十五的李灵仙姐诞，村民都会大事庆祝，祈祷庇佑村民世代昌盛。",https://dimg04.c-ctrip.com/images/0105u120009i5meni7A71.jpg
香港,摩天巨轮,2857161,22.229166,114.177122,4.7,摩天巨轮位于海洋公园，游客乘坐摩天巨轮，可以俯瞰海洋公园的美景，还可以远眺浩瀚的大海。,https://dimg04.c-ctrip.com/images/0102h12000cor2xttD9FB.jpg
香港,罗屋民俗馆,1711032,22.261455,114.2403,4.2,罗屋民俗馆建于清朝，是一间历史悠久的古村屋。馆内藏品的内容主要介绍了柴湾的历史、罗屋的历史和特色，以及客家人的生活习俗。屋内放有家俬、农具、日用品等展品，以复原村屋的面貌。,https://dimg04.c-ctrip.com/images/0100g12000bar7edr7BAA.jpg
香港,GoNature攀石场,1710968,22.306352,114.229292,0.0,GoNature Climbing Gym是全港很大的室内攀石场，面积为6500平方尺。场内有超过100条攀石路线，设有多角度、不同斜度的石墙，并设有驻场教练。攀石场还备有淋浴设施、储物柜、空气调节系统、音响设备、无线宽带网络设备、休闲区。,https://dimg04.c-ctrip.com/images/0ww1l12000946m58w695E.jpg
香港,热带雨林探险径,2857098,22.231238,114.176431,4.3,踏上这条热带雨林探险径，将会遇上各种雨林中的稀有动物。率先亮相的包括巨嘴鸟家族中的托哥巨嘴鸟，体型娇小的绿簇舌巨嘴鸟，还有颜色如宝石般夺目耀眼的箭毒蛙！旅程中还会发现号称淡水鱼巨鱼的海象鱼，以及拥有一双大眼睛的蜜熊等其它珍贵动物。,https://dimg04.c-ctrip.com/images/0103a12000bbkcr4e6973.jpg
香港,大埔海滨公园,4611774,22.44983,114.193307,4.4,大埔海滨公园-自然生态公园占地面积约二十二公顷，里面建有海滨步行径、缓跑径、单车径和露天剧场，另外，公园内还有一个扇形花海，非常漂亮。,https://dimg04.c-ctrip.com/images/0105m22155d01ixz4023D.jpg
香港,廉政公署总部大楼,5068871,22.290177,114.210449,4.7,廉政公署总部大楼位于渣华道，由关善明建筑师设计建造的，设有演讲室、展览厅、模拟录影会面室等多个区域。,https://dimg04.c-ctrip.com/images/0103112000axk198oED4F.jpg
香港,大澳乡事委员会历史文化室,1711067,22.25033,113.866876,4.0,大澳乡事委员会历史文化室位于大澳永安街5号，整个展馆面积不大，展品大都是上个世纪四五十年代甚至更早期的物品。其中有他们赖以为生的捕鱼工具，包括防风设计的风灯、搭棚装船用的平水尺和手动木钻；另外也有渔民的日常生活用品，比如上世纪50年代的结婚礼服、暖茶器等。看着这些物品，你可以想象出那个年代的大澳渔民拥有怎样的生活。,https://dimg04.c-ctrip.com/images/0103b120008i5oudh0365.jpg
香港,龙虾湾郊游径,2124090,22.297685,114.309597,4.3,龙虾湾郊游径位于清水湾郊野公园，相接大坑墩和龙虾湾，沿途风景优美。沿途可以远望到清水湾东面的海角，以及清水湾、布袋澳、牛尾海和西贡海的海湾风光。整个郊游径全长2.3公里，适合徒步旅行和欣赏自然风光。,https://dimg04.c-ctrip.com/images/0103i120008j0r6o52F42.jpg
香港,慧翠道社区园圃,4611351,22.282502,114.20229,4.0,,https://dimg04.c-ctrip.com/images/0106812000987lsllD626.png
香港,清暑轩,1711017,22.442893,114.010337,4.0,清暑轩坐落于香港元朗屏山，与觐廷书室相邻，是屏山文物径的文物之一。清暑轩由邓氏第22代族人邓香泉兴建，于1874年落成，为当时的访宾客及鸿儒的下榻居所。作为旅馆，清暑轩的装饰及排场相当不俗，内有很多以融荟中西风格的新派吉祥图案，华丽而见心思。馆中亦有玲珑雅致的庭堂，精巧细腻的木雕、灰塑，连厢房的漏窗亦是一丝不苟，显尽当年邓族地方豪门的气派。,https://dimg04.c-ctrip.com/images/0103412000cae90y3A58D.jpg
香港,汀九灣泳灘,4614160,22.366561,114.085584,3.8,汀九湾泳滩是一个好的观景点，人们可以在这里散步、休息和眺望海景，是一个休闲放松的好去处。,https://dimg04.c-ctrip.com/images/0106k2233zjog14k04356.jpg
香港,瘋狂過山車,2857181,22.228896,114.177121,4.5,,https://dimg04.c-ctrip.com/images/0100d120009iniu8i68C8.jpg
香港,金钟,1711019,22.276908,114.170466,5.0,该地方位于港岛，是中央商务区东侧一个繁忙的旅游、购物和商业区。,https://dimg04.c-ctrip.com/images/0ww2e12000chk4aie31F1.jpg
香港,尤德观鸟园,2125910,22.273774,114.16548,4.0,尤德观鸟园占地面积约三千平方米，园内生活着很多鸟类，有大眼斑雉、拟啄木鸟、鹧鸪等，此外，这里的植被也非常丰富，有无花果树木棉、石栗、棕榈树、竹和羊齿类植物。,https://dimg04.c-ctrip.com/images/0101u12000bc70gqk2F9E.jpg
香港,白泥,1694107,22.431988,113.953152,4.0,白泥位于元朗区西部海滨，对面即是深圳蛇口，这条约六公里长的海岸线上集中了红树林、鱼塘、农场、棚屋和撒满牡蛎壳的泥泞海滩等。是香港观欣赏日落的较好地点之一，因此成为摄影爱好者们的汇集地。,https://dimg04.c-ctrip.com/images/0ww651200094bnu3m4F6C.jpg
香港,香港回归祖国纪念碑,2525746,22.281691,114.177132,4.8,该纪念碑位于位于会议展览中心西北面，与坐落广场东北面的“永远盛开的紫荆花”雕塑相互辉映，纪念碑由基石、柱身和柱头三部分组成。,https://dimg04.c-ctrip.com/images/0104712000axaeb81FC42.jpg
香港,竹林禅院,1711028,22.37543,114.123714,4.6,竹林禅院位于荃湾区，这里风光明媚，气候适宜，环境优美，是人们休闲旅游的好地方。寺院内有大雄宝殿，东林念佛堂，韦驮殿，浮屠殿，钟楼、鼓楼等建筑物，装修古朴雅致，亦供奉了全港较大的三宝佛佛像，庄严肃穆。,https://dimg04.c-ctrip.com/images/0105v12000balv1w557B9.jpg
香港,成品生活 (尖沙咀店),4562144,22.291792,114.173842,4.3,,https://dimg04.c-ctrip.com/images/0106k12000bbp99yh0DC9.jpg
香港,佛堂门天后古庙,1710990,22.267813,114.294784,4.0,佛堂门天后古庙（俗称大庙）主奉天后妈祖，是香港较为古老的天后庙，也是广东沿岸现存较为古老的天后庙，始建于南宋咸淳二年（1266年）。庙内仍保留了清朝嘉庆四年(一八零四年)所铸的铁香炉及道光二十年(一八四零年)铸造的铜钟等文物。该庙属于三开间单进设计，大殿供奉天后娘娘，右偏殿则有一座铜钟及龙床。每年农历三月廿三日是天后诞，当天前来的信众达三四万人之多。善信更喜欢到侧殿摸龙床，以求子或财帛。,https://dimg04.c-ctrip.com/images/0103u12000baplrlgDAA5.jpg
香港,马宝宝社区农场,1711068,22.499871,114.147843,4.6,马宝宝社区农场是一个环保型的花园农场。农场定期举办农墟、导赏团、工作坊及耕种班，是市民在周末远离城市喧嚣的好去处。这里还可以买到当地新鲜的本地有机菜、天然肥皂、本地蜂蜜、有机零食等。,https://dimg04.c-ctrip.com/images/0102112000bctk0paA4D9.png
香港,中区自然径,1710992,22.270598,114.16198,4.3,中央自然径是位于半山的一处步道，这里绿树环绕、芳草萋萋、小路深幽，站在山顶可以一览周围风景，是徒步游的不错之选。,https://dimg04.c-ctrip.com/images/010211200085mrf4f52EC.jpg
香港,冲天遥控车,2691999,22.307715,114.044377,5.0,这是一个刺激的游戏项目，遥控车会在高耸的“U”形轨道上高速俯冲，上下来回、高速奔驰。遥控车的引擎不断加速，带您驰骋越来越高的天空，让您尽情享受飞一般的刺激感觉。,https://dimg04.c-ctrip.com/images/0106g12000f6qduroACF2.jpg
香港,香港规划及基建展览馆(夏悫道),1711111,22.276923,114.169971,5.0,香港规划及基建展览馆是一个以香港未来的城市规划与大型基建为主题的展览馆。,https://dimg04.c-ctrip.com/images/0ww51120009493215EA26.jpg
香港,大屿山郊野公园,4611676,22.254204,113.993316,4.4,南大屿郊野公园内有凤凰山、芝麻湾石林、分流炮台等景点，生态资源丰富，是一个郊野公园。,https://dimg04.c-ctrip.com/images/0100112000827p1r451F2.jpg
香港,动感快车,2857156,22.232623,114.177363,4.8,动感快车，是中国第二架B&M无地板过山车。位于香港海洋公园“动感天地”园区。倚山临海而建的 “动感快车 ”采用双脚悬空设计，让您双脚凌空，在呼啸的海风中，对准大海极速俯冲！一个接一个的回旋和急弯，加上强劲的4G地心吸力，给您更快、更狂、更激烈的离心体验，惊恐的尖叫之声响彻云霄！,https://dimg04.c-ctrip.com/images/0102i12000banv5q1066D.jpg
香港,功夫阁,2020336,22.296432,114.176234,4.7,功夫阁位于九龙公园里面，人们可以在这里观看武术表演和舞狮表演，是一个休闲的好去处。,https://dimg04.c-ctrip.com/images/0102s12000ben7dsfAD8F.jpg
香港,黄家驹墓,3234333,22.289482,114.250507,4.6,该墓地是Beyond成员黄家驹的埋葬之地，每年都会有世界各地的歌迷来这里祭拜。,https://dimg04.c-ctrip.com/images/0101f12000b6qlusu8C46.jpg
香港,太平山永利街,5068891,22.280488,114.155185,3.8,该街保留了早期港岛的风貌，是一条历史悠久的街道，老街内保存的唐楼吸引了很多人来参观。,https://dimg04.c-ctrip.com/images/0104512000a51byic48B2.jpg
香港,怡和大厦,1711038,22.280253,114.164259,4.5,怡和大厦又称康乐大厦，楼高五十多层，于1973年建成，是当地知名的摩天大楼，大楼内有一千多扇圆形的“月洞门”窗户，非常漂亮。,https://dimg04.c-ctrip.com/images/0104t120009hf3z3a8769.jpg
香港,城门水塘,1827806,22.383284,114.152293,4.3,城门水塘，自然物种繁多，多个品种的蝴蝶择居于此，大批候鸟也来度冬，这里可以说是动植物的天堂。城门水塘原址是大围村，这里有一个山林，种植多达70多种树木，现已被划为“特别地区”加以保护。,https://dimg04.c-ctrip.com/images/01002120008e2bsyu8B81.jpg
香港,HK Free Walk,2020246,22.290893,114.174565,4.5,,https://dimg04.c-ctrip.com/images/0104n12000bfbnjoyB1F2.jpg
香港,绿汇学苑,4408934,22.443851,114.174909,4.1,,https://dimg04.c-ctrip.com/images/0104912000crkixsl9DE4.jpg
香港,廖万石堂,1711081,22.507719,114.129277,3.8,廖万石堂位于香港新界上水上水乡门口村与中心村之间，为上水廖族较大的祠堂，建于清乾隆十六年。廖万石堂属于三进两院建筑，整座建筑装饰华丽，灰塑、木刻、壁画、泥塑等比目皆是，题材多为传统吉祥图案。,https://dimg04.c-ctrip.com/images/0ww5q12000948mevp6EA3.jpg
香港,圣士提反湾,1711036,22.209055,114.219507,4.6,圣士提反湾泳滩，因附近的圣士提反书院和其附属小学而得名，这里是眺望赤柱湾的好地方，此外，人们还可以在这里玩帆板和独木舟，非常有趣。,https://dimg04.c-ctrip.com/images/1A0b15000000y7luh2AB9.jpg
香港,鲁班先师庙,1710998,22.280389,114.137005,4.0,鲁班先师庙又称鲁班庙，位于香港香港岛中西区西环青莲台15号，是香港岛中唯一一间拜祭鲁班的庙宇，现被列为香港一级历史建筑。庙宇建于清朝光绪十年（1884年），属两进式非合院建筑物，屋顶由木建造，并以瓦片铺盖；庙内又有丰富的建筑装饰，包括：壁画、大量雕刻塑像、浮雕等。,https://dimg04.c-ctrip.com/images/0104s12000bcy4bs6C3D8.jpg
香港,海洋列车・高峰站,3795323,22.232092,114.175834,4.7,,https://dimg04.c-ctrip.com/images/0104q12000bbp9uxaBD98.jpg
香港,大潭郊野公园,1710900,22.251365,114.212103,4.3,大潭水务文物径设在大潭郊野公园附近，沿途绕经大潭上水塘、副水塘、中水塘和大潭笃水塘，全长五公里，走完全程大约需要2小时。漫步这条文物径时，可以看到不同年代、不同类型的水务设施，当中包括水坝、石桥、石砌输水道、水掣房、原水抽水站和员工宿舍，大部分至今结构仍然十分完好。这些水务历史建筑物旁边都设有介绍牌，对这些水务设施多一分了解，有助于认识香港一百五十年来的供水历史。,https://dimg04.c-ctrip.com/images/0104812000a5bfrm1C537.jpg
香港,机场核心计划展览中心,1710870,22.361375,114.07553,4.0,"机场核心计划展览中心位于汀九青山公路401号，是一座别具风格的单层建筑物，一般称为""白楼""。该中心设有五个展览区，展出整项新机场计划共十项工程的模型、图片，并附以说明文字，让参观者对整项工程有全面的认识。该十项工程分别为：赤鱲角香港新机场、青屿干线、机场铁路、西区海底隧道、北大屿山快速公路、三号干线、西九龙快速公路、西九龙填海计划、中环及湾仔填海工程，以及东涌发展计划。位于天台的观察台及中心外的花园均设有望远镜，可供参观者欣赏青马大桥的壮丽景色。",https://dimg04.c-ctrip.com/images/0104712000b01sbr737D0.jpg
香港,从心苑,1700120,22.340102,114.198637,4.5,从心苑是黄大仙祠后面的一座小花园，这里既有亭台楼阁，又有曲廊小桥，池塘里还放养着鲤鱼。虽然从心苑不大，但这里幽静雅致，来这里随意走走也十分惬意。,https://dimg04.c-ctrip.com/images/0106t12000baiy9ws07D4.jpg
香港,青协有机农庄,1710774,22.406155,114.078828,4.0,,https://dimg04.c-ctrip.com/images/0106e12000bc971nfCF20.jpg
香港,Rosie Jean's Cafe,31042790,22.280169,114.155507,5.0,,https://dimg04.c-ctrip.com/images/0HJ2112000i0ijkuo5A20.jpg
香港,中国人民解放军驻香港部队大厦,1711011,22.278977,114.169095,5.0,威尔士亲王大厦位于爱丁堡广场，1997年6月30日午夜，中国及英国两方防务交接仪式在此举行。2002年1月1日，大厦正式改名为现在的名字。,https://dimg04.c-ctrip.com/images/0100n12000bagzdj17EF8.jpg
香港,亚洲协会香港中心,1710889,22.273152,114.170234,4.0,亚洲协会香港中心曾经是个军火库，现在，这里经常举办各种展览及学术活动，里面还设有多功能厅、咖啡厅和礼品店。,https://dimg04.c-ctrip.com/images/0ww3h12000apir6nj4824.jpg
香港,历奇喷水池,2695960,22.308493,114.045926,4.3,,https://dimg04.c-ctrip.com/images/0101e120008dujt0uC020.jpg
香港,海怡半岛,3234334,22.240688,114.152675,4.6,海怡半岛位于港岛南端，海对面是南丫岛。每当太阳从南丫岛落下时，余辉给来往船只、海面及岸边的建筑物镀上了一层金色...,https://dimg04.c-ctrip.com/images/0102u120009hlt24wF49F.jpg
香港,双鹿石涧,1710979,22.399196,114.364333,4.0,双鹿石涧源起西贡牌额山、大枕盖与田尾山间之山谷，由西向东南奔流至西湾止。此涧被视为香港九大石涧之一，全长约6.5公里。其中较具人气的景点要属由数条瀑布串连而成的四叠潭，因为水潭清凉透澈，是许多游客消暑畅泳的热门地点，从西湾亭入口处步行10分钟左右即到。,https://dimg04.c-ctrip.com/images/0ww0k120009rkupfd1425.jpg
香港,"Local Cooking Experience, Hong Kong",2020367,22.24126,114.154372,0.0,,https://dimg04.c-ctrip.com/images/0100y120009bf5gbk05E7.png
香港,香港新闻博览馆,5059343,22.280638,114.155958,4.6,香港新闻博览馆于2018年12月5日正式开幕，是一个以新闻作主题的博览馆，介绍香港新闻业的历史及发展，并展出珍贵旧新闻器材、新闻片段及报纸等。馆内设不同分区，透过展版、短片及互动触控萤幕等讲述不同媒体的新闻发展历史，并设有特设专区阐述新闻界大事。博览馆位于本身为3级历史建筑的前必列啫士街市场内，除参观展区外，市民亦可在馆内体验做电视主播，以及拍摄并购买以报纸作主题的纪念相片。,https://dimg04.c-ctrip.com/images/0106z12000bbnrh11ABF9.jpg
香港,荃湾海滨公园,5068771,22.360651,114.117703,4.2,荃湾海滨公园是一个沿海而设的公园，这里的景色优美，沿岸种植了各种树木，还有跑道，休憩亭等，是休闲游玩的好去处。,https://dimg04.c-ctrip.com/images/0101w2233zsmqnbapA344.jpg
香港,西湾国殇纪念坟场,1711041,22.255794,114.238951,4.0,西湾国殇纪念坟场位于东区柴湾以南的黑角头一带，是一座坟场。这里设有烈士之墓，安葬着1500多名二战中奋力抵抗敌人入侵而阵亡的军人。,https://dimg04.c-ctrip.com/images/0ww70120009479xto0B71.jpg
香港,戏曲中心,5103424,22.299438,114.172248,4.6,戏曲中心是西九文化区较早落成的表演艺术场地，于2019年1月20日正式开幕。这里定期上演各种戏曲节目并举办相关活动，满足不同类型观众的需求。其中，位于顶层的大剧院云集各地区的知名戏曲艺术家及剧团，上演传统及创新戏曲表演。茶馆剧场适合小型演出，以独特氛围吸引新观众。在戏曲中心，有戏曲电影放映、工作坊、讲座和展览等丰富活动。,https://dimg04.c-ctrip.com/images/350h15000000xdiow2EF9.jpg
香港,香港龙狮节,2020222,22.291124,114.175313,4.7,舞狮是我国流传千年的民间习俗，为推广香港龙狮文化，打造本地旅游业观光品牌，“香港龙狮节”自2011年首次举办，历年都吸引了众多香港市民和游客参与，近年来更成为香港一大旅游盛事。,https://dimg04.c-ctrip.com/images/0105h12000budjzy1A162.jpg
香港,景贤里,1700106,22.263986,114.185858,4.5,景贤里位于湾仔司徒拔道，是一座有着70年历史的大屋，有中国古代建筑的影子，砖红墙面绿色瓦顶，外形十分古典而华贵，在香港是属于比较罕见建筑艺术品。,https://dimg04.c-ctrip.com/images/0ww0y12000949423h2571.jpg
香港,么地道公园,4611441,22.29594,114.183896,4.0,,https://dimg04.c-ctrip.com/images/0104112000bbor18s1F85.png
香港,香港仔海滨公园,5701671,22.244481,114.160293,4.3,香港仔海滨公园 于1992年落成启用，内部设有露天广场、儿童游乐场及篮球场等设施。沿岸设有多个码头，有珍宝海鲜舫的驳艇。,https://dimg04.c-ctrip.com/images/0105412000bbneqo6A70B.jpg
香港,观塘海滨花园,2020253,22.309591,114.221837,4.5,观塘海滨花园有海滨长廊，草地，喷泉，场地开阔，人们可以在此野餐，欣赏美丽的风景。,https://dimg04.c-ctrip.com/images/0101n12000baqauarDDFF.jpg
香港,牛棚艺术村,148012,22.318057,114.196493,4.0,牛棚艺术村隐藏在九龙土瓜湾的一个旧街区里，是一处战前屠宰厂和检疫站，始建于1908年，这个红砖瓦房现已被列为三级文物。艺术村里，大约有大大小小十几间工作室，墙上的涂鸦、门前的雕塑，让这里充满了艺术气息。,https://dimg04.c-ctrip.com/images/0101g12000bar2i1o896B.jpg
香港,鸭脷洲风之塔公园,5701629,22.242166,114.157728,4.6,鸭脷洲风之塔公园内有一个观景台、步道和日晷，其中，观景台高约十米，外形似一艘渔船，会随风速改变颜色。,https://dimg04.c-ctrip.com/images/0102412000bba4mor6AD2.jpg
香港,长洲渡轮码头,5068869,22.20593,114.033328,4.7,长洲渡轮码头客流量很大，尤其是周末和假日的时候，经常会人满为患。码头的客轮有快船和慢船之分，如果不着急，建议坐慢船，可以看沿途风景。,https://dimg04.c-ctrip.com/images/0100z12000bbl2xak6B6C.jpg
