city,名称,id,纬度,经度,评价分数,介绍,封面图片
香港,怡和午炮,64888,22.279791,114.188687,4.4,怡和午炮位于铜锣湾，午炮及其他几门小型礼炮都是由怡和公司装设的。每有大班抵港或是离港，怡和洋行会鸣炮相迎送，至今将这一鸣炮的传统延续了下来，如今每日中午十二时，这里会举行鸣放礼炮的仪式。此外，炮台也会在除夕零点时鸣炮，有送旧迎新之意，名为“子夜鸣炮”。,https://dimg04.c-ctrip.com/images/0103u120009f6if2iABF8.jpg
香港,云枕山,1711029,22.234109,114.248039,4.8,龙脊是指打烂埕顶山至云枕山的山顶之间一段高低起伏的山路。走在龙脊上，有如乘龙飞行，清风送爽，大地彷佛就在脚下，有时更有许多蝴蝶陪您漫步。多本旅游指南都曾大力推荐这条方便易达的市区远足径，沿途您可以饱览石澳、大浪湾、赤柱及大潭一带的壮丽景色。龙脊全程从起点土地湾至终点大浪湾约8.5公里，需要4-6个小时。夏季来远足时，还可以带套泳衣，走到终点大浪湾时下水去冲浪游泳。,https://dimg04.c-ctrip.com/images/10091f000001gsofs06B2.jpg
香港,飞鹅山观景台,65725,22.350193,114.226286,4.3,在飞鹅山，登上观景台，既可以欣赏西贡浩瀚的大海及数十个岛屿，也可以观赏整个九龙、港岛全景，这里也是星期天很多人驾车郊游的好去处之一。这里也是人们放风筝、飞机航模的好地方，因此，星期天也有很多亮丽的风筝、航模在天空飞荡。,https://dimg04.c-ctrip.com/images/0100k120009zoyxtq16F3.jpg
香港,凤凰径,50701,22.246411,113.932959,4.0,凤凰径是一条长途的行山径，位于南大屿山郊野公园，于1984年12月4日正式启用。凤凰径环绕大屿山南部，经过梅窝、贝澳、塘福、昂坪等地，和凤凰山及大东山山岭，全长70公里，共分12段，由梅窝为起点。此径连接大屿山多个景区，包括南山植林区、凤凰山、宝莲禅寺、龙仔悟园、大澳、分流等。行山者可选择合的路段作游、远足或露营。路段介绍第一段：梅窝至南山（全长约2.5公里，需时约0.75小时，难度：*）  第二段：南山至伯公坳（全长约6.5公里，需时约2.75小时，难度：***） 第三段：伯公坳至昂坪（全长约4.5公里，需时约2.25小时，难度：***）第四段：昂坪至深屈道（全长约4公里，需时约1.25小时，难度：**）第五段：深屈道至万丈布（全长约7.5公里，需时约2.75小时，难度：**）第六段：万丈布至大澳（全长约2.5公里，需时约1小时，难度：**） 第七段：大澳至狗岭涌（全长约10.5公里，需时约3小时，难度：***） 第八段：狗岭涌至石壁水塘（全长约5.5公里，需时约1.5小时，难度：**）第九段：石壁水塘至水口（全长约6.5公里，需时约2小时，难度：*） 第十段：水口至东涌道（全长约6.5公里，需时约2小时，难度：*） 第十一段：东涌道至贝澳（全长约4.5公里，需时约1.25小时，难度：*）第十二段：贝澳至梅窝（全长约9公里，需时约3小时，难度：**）首五段须要跨越陡峭的山路，游客应该量力而为，以分段游览为佳。而凤凰山是香港的第二高峰，比其东面的大东山更高。由于主、副峰分别称为凤、凰，故此名为凤凰山，游客可由东涌乘搭大屿山巴士前往昂坪，再沿指示牌前往凤凰观日牌坊，凡在凤凰山上观赏过日出的游客，均会被它磅礡的气势所慑服。,https://dimg04.c-ctrip.com/images/0102a120009fib4c8DAEC.jpg
香港,榕树湾渡轮码头,133024,22.223884,114.114202,3.9,榕树湾是香港南丫岛西北的一个海湾，北接牙较湾，东望榕树岭，南面与香港电灯在南丫岛的发电厂相隔一座小山。在中环有渡轮直达榕树湾。码头附近风光秀丽，景色宜人，能在这里度过一个懒散的午后，也极为的惬意。,https://dimg04.c-ctrip.com/images/fd/tg/g3/M0B/B8/F7/CggYGlaM2Z2AbnXmACjuzJqQbMY866.jpg
香港,三栋屋博物馆,3334,22.369286,114.125409,3.9,三栋屋博物馆是香港古老的围村之一，典型的客家围村，虽有逾200年历史，仍保存得相当完好，出色的修葺工作更令博物馆获得亚太旅游协会1990年度的“太平洋古迹大奖”。三栋屋博物馆的建筑布局有如棋盘，左右对称，中轴线上分别建有前厅、中厅及祠堂；两旁分别为四间独立的居室，左右及后排的横屋把整个村庄围拢起来，博物馆设有展览厅和演讲厅，展出古老的家具、手工艺品、农具和客家人的日用品等，同时见证了荃湾由农业区蜕变成现代化巿镇的过程。2016年6月，非物质文化遗产办事处在三栋屋博物馆设立“香港非物质文化遗产中心”，作为其展示和教育中心，透过多元化的教育和推广活动，包括举办展览、讲座、研讨会、传承人示范和工作坊等，提升公众对非物质文化遗产的认识和了解。,https://dimg04.c-ctrip.com/images/100b0l000000cu8krE5CE.jpg
香港,米埔,3314,22.49229,114.039011,4.2,米埔自然保护区位于元朗湿地，有着大面积的红树林区，保护区内数量众多的珍贵动植物以及大量昆虫，飞禽走兽等。每年春秋两季，会有大量候鸟往来中国北方、蒙古、西伯利亚与东南亚及澳大利亚之间，迁徙途中就会在米埔中转，冬天更多的水鸟在此栖息过冬，这段时间就是米埔观鸟时机了。米埔自然保护区被列为禁区，未经允许不可随意入内，因此参加世界自然基金会分会组织的导览团是很好的游览方法。跟随导览团可以前往基围虾塘、观鸟屋、野生动物栖息地及浮桥参观，会看到很多种类的候鸟，幸运的话还能邂逅濒危物种比如黑嘴鸥，黑脸琵鹭这类珍贵物种。尤其在踏入冬季中期，在后海湾一带甚至能看到几万只水鸟的壮观景象。,https://dimg04.c-ctrip.com/images/10080l000000cu5v771A2.jpg
香港,志莲净苑 天王殿,1700077,22.337679,114.209931,4.4,志莲净苑始建于1936年，占地约30000多平方公尺，坐北向南，背山面海。60多年来致力安老、教育、社会福利及宗教文化等事业。1989年根据社会环境变化的需求进行了整体重建，先后兴建安老院、大礼堂、露天剧场、佛寺建筑群、公园以及一所特别技能训练中学等。志莲净苑是一座仿照唐代艺术风格设计的木构建筑群，布局层次分明，建筑沿中轴线作主次分布，内有大雄殿等殿堂和馨香扑鼻的荷花公园。,https://dimg04.c-ctrip.com/images/1me5u12000at8kr8j15E6.jpg
香港,吉庆围,3336,22.437006,114.069507,3.0,吉庆围在元朗东边的广阔农村地带，这里有出名的古老围村──吉庆围。吉庆围呈长方形，占地45亩（长约100米，宽约90米），设计整齐、对称，是典型的围村建筑。里面是一幢幢整齐排列的家屋。四周用青砖筑了一道坚固的城墙，四角还有炮楼，墙外并有护城河，是一个具有高度防御作用的建筑。邓氏远祖邓符协早于北宋时来此定居，后来族人邓伯经与另外两人于明朝成化年间（1465年至1487年）建筑围村居住，至今已逾500年历史。这里住有大约400个邓氏后人。其实在锦田区同样的村围还有好几座，比如北围、南围、永隆围、泰庆围等合称“锦田六围”，但以吉庆围完整，并且可以开放参观。吉庆围里面倒是可以随心的走走看看，外面的城墙倒是挺适合慢慢欣赏观看。整个吉庆围只有一个出入口，门口外有一块记载邓氏历史的铜牌，铜碑上面记载着详细的邓氏发展史，从邓氏远祖邓符在北宋时期来到这里，这数百年的风雨历程。有兴趣的话可以瞧瞧。从门口走进去可以看到两侧整齐排列的几家贩卖纪念品的商店，妇女特地穿上黑色的民族服装，供人拍照。要付几元港币才好拍照喔。继续往里走，可能有些稍稍的失望，因为里面的许多的居民楼都已经翻新，很少有保存下来的古建筑，除了走到村落的较里端有一处小祠堂，里面有供奉着15位神祇，可以顺带瞧瞧。别的看点可能有些少。整个吉庆围里都是一些现代的普通民居，要是觉得没什么可看的就按照原路返回，从正门出来城墙的两旁还有碉堡、炮楼一直被保存了下来，还能看见护城河穿插在其中，单说城墙就有大概18英尺厚。虽然这些城墙、碉堡已经斑驳不堪，甚至还有些破旧，但这些古建筑历经百年沧桑仍然被保存了下来，也是非常不易，所以这几个地方很适合给自己拍几张典雅唯美的照片。,https://dimg04.c-ctrip.com/images/10060d0000006u2bfC257.jpg
香港,诺士佛台,1710964,22.298461,114.178969,4.5,诺士佛台位于香港九龙尖沙咀，在香港天文台侧的小山丘上，是一个隐藏在高楼大厦中的美食美酒区。钻进小巷弄，跟着酒香、随着歌声，自会发现这一片美味新天地。从天文台道到诺士佛阶的沿路摆满了酒吧及餐厅的台椅，这里有逾30家富有异国风情的特色餐馆及酒吧，提供环球美食和佳酿，意大利菜、法国菜、泰国菜、日本菜、中东菜、墨西哥菜……七分美味、三分醉意，让您饱尝一顿十全十美的盛宴。而且这里的酒吧相比苏豪区和兰桂坊来说更加大众化和本土化，价格相对便宜。诺士佛阶还设有楼梯与美丽华商场相连。,https://dimg04.c-ctrip.com/images/0107012000csxzuqgC522.jpg
香港,香港港澳码头,1710869,22.286865,114.157834,4.6,港澳码头位于香港上环信德中心三楼，是香港跨境码头之一，主要提供往返香港与澳门之间的高速客轮服务，也有航线到珠海、深圳蛇口、中山等地。乘坐客轮到澳门单程需要大约1个小时时间，票价在180港币左右，班次很多，20-30分钟就有一趟。想观景的话，建议上船之前在服务台选靠窗的座位。另外，码头天台还有一处空中快线直升机场，可以在这里搭乘飞机前往澳门，时间约16分钟。,https://dimg04.c-ctrip.com/images/100t1f000001gqdf8F521.jpg
香港,Big Bus香港观光巴士游,1711456,22.283625,114.166344,4.2,【九龙夜游】天黑后沉浸在香港的霓虹灯景观中。九龙夜游将穿越繁华的九龙市中心，游览尖沙咀弥敦道、热闹的庙街夜市、广东道、钟楼和香港体育馆等景点。旅程于尖沙咀海滨长廊结束，是观看精彩的免费表演幻彩咏香江的好地方，该表演每晚 8:00开始。【香港岛红线】沿着香港岛游的敞篷巴士，您可探索到香港不同的面貌，从摩天大厦林立的中环、繁华热闹的购物区、悠闲的苏豪区、富有殖民地色彩的荷里活道、古色古香的文武庙等。【赤柱绿线】敞篷巴士将途经浅水湾、深水湾、赤柱、香港仔及维多利亚港，让您安坐车上欣赏沿着海岸线的壮丽风景。当您到达赤柱后，您可自由游览赤柱的特色景点如赤柱市集、美利楼、卜公码头、赤村海滨长廊及赤柱正滩，并在1小时后乘搭敞篷巴士回程。,https://dimg04.c-ctrip.com/images/1lo3412000gwb4ks4E232.jpg
香港,广福义祠,110269,22.282413,114.152653,3.8,济公庙位于太平山街的广福义祠，这座于1856年建成的祠，是供街坊供奉先祖的百姓祠堂，亦曾经是病患的收容所，见证了旧时庙宇不一样的角色。自从已故歌星张国荣曾在这里祈求姻缘后，该庙声名大噪，来参拜的人们多以红线系上塔香，祈求姻缘。不少明星也在庙内系红线来求姻缘。,https://dimg04.c-ctrip.com/images/0101012000bameylpB6F6.jpg
香港,东龙洲,1711008,22.245406,114.294387,4.0,东龙洲又名南堂岛，位于清水湾以南。岛上有清朝时候遗留的炮台，古代临崖石刻。此外，东龙州还是攀岩和徒步旅游的场地，很多游客喜欢来此露营或观看海上日出。,https://dimg04.c-ctrip.com/images/100w0l000000cz72xA836.jpg
香港,玫瑰堂,1711505,22.299678,114.181494,4.4,尖沙咀玫瑰堂，又称九龙玫瑰堂，是香港一座可容纳800人的天主教教堂，为香港二级历史建筑。教堂用象牙色陪衬砖红的墙涂建而成，给人感觉清新和谐，教堂布置的精细，没有典型哥特建筑那种庄严，显得很有活力。墙身很干净维护得非常好，窗户上的彩色玻璃片也很漂亮。,https://dimg04.c-ctrip.com/images/1A0a14000000w0q7dA327.jpg
香港,西环钟声泳棚,2826315,22.277248,114.122545,4.5,西环泳棚是六七十年代市民游水的地方，一条长木桥、一些竹棚、一个简陋的更衣室，可以说就是当年的公众泳池了。如今的西环泳棚来游泳的已经很少了，平日多是来钓鱼的伯伯，这里的日落很美，不仅吸引了摄影爱好者，亦有很多情侣来游玩及新人来拍婚纱照。 ,https://dimg04.c-ctrip.com/images/0102112000ik6la4bFE50.jpg
香港,桥咀洲,1694102,22.360398,114.298856,4.0,桥咀洲是香港联合国教科文组织世界地质公园景点之一。这个又细又长的岛屿不仅有1.4亿年前形成的地质奇观，还有绿意盎然的大自然美景。如果您想在一天内既欣赏海岸及岩石奇景、又漫步轻松短途的远足径，还能在蔚蓝海湾畅泳，这儿适合不过！,https://dimg04.c-ctrip.com/images/100r0l000000csns61AFC.jpg
香港,骆克道街市熟食中心,2483859,22.275288,114.18039,4.7,湾仔的骆克道一带背靠维港，上世纪五六十年代，美国水兵成为了这里的常客，也带动了酒吧的迅速发展。后来士兵们离开后，如今只有各式酒吧保留了下来，成为香港当地人常去的夜生活名地。,https://dimg04.c-ctrip.com/images/0106912000atz1sgw85B2.jpg
香港,将军澳医院,1791251,22.31544,114.27457,4.7,说起“将军澳医院”可能没几个人知道，但如果说“仁爱医院”，TVB迷们可能就无人不晓了。《妙手仁心》三部曲就是在此取景拍摄的，“仁爱医院”的原型就来自将军澳医院，该医院离TVB的大本营电视广播城只有10分钟的车程。,https://dimg04.c-ctrip.com/images/0103s12000bamliwy3529.jpg
香港,香港电车叮叮车,1413441,22.284712,114.141368,4.4,叮叮车是熙熙攘攘的香港街道不可分割的一部分，而且它还是全世界仅有的双层有轨电车。叮叮车行驶的路线是香港繁华的商业中心，途径西环、上环、中环、湾仔、太古、筲箕湾及维多利亚港沿岸，这种只有香港岛才有的古老交通工具，实际上是一种电车，由于开车时司机踩到踏脚车子会发出“叮叮、叮叮”的声音而著名，故人们喊它叮叮车。电车现时经营6条部份重叠的路线连接坚尼地城至筲箕湾，平均每1分30秒内有电车到达车站，6条主要路线分别如下：1、筲箕湾至上环街市（星期一至五尖峰时间有特别班次来往筲箕湾至坚尼地城）；2、筲箕湾至跑马地；3、北角至石塘咀；4、跑马地至坚尼地城；5、铜锣湾至坚尼地城；6、上环街市至坚尼地城（只在星期一至五尖峰时间服务）。叮叮车运行线路图详见官网。,https://dimg04.c-ctrip.com/images/100c1f000001gsxii086E.jpg
香港,贝澳营地,1694112,22.2364,113.983869,4.3,贝澳泳滩位于大屿山岛，这里干净整洁而且设施齐全，还可以烧烤，人们吃着美食，看海景，非常舒爽惬意。,https://dimg04.c-ctrip.com/images/0102k12000ax8snfd8EB3.jpg
香港,凤园蝴蝶保育区,1710977,22.464352,114.184445,4.3,凤园蝴蝶保育区位于大埔市郊，生存着200多种蝴蝶，是赏蝶的好地方。园内的训练中心经常举行生态讲座，增加参观者对蝴蝶的认识和了解，另外还有机田园和蜻蜓池等设施。,https://dimg04.c-ctrip.com/images/0ww3o120009rkkrg81D0F.jpg
香港,香港水晶巴士游,2483364,22.316073,114.173585,4.3,利用短短的数小时，以快捷的方法了解香港风土人文和美食文化，水晶巴士一定是你合适的选择！让你在车上享受香港特色美食的同时，环游香港不同美景。水晶巴士是香港第一辆集旅游与美食的双层观光巴士，于2017年3月14日正式启动，世界各地超过60个媒体报导。巴士内外设计豪华时尚，设有餐枱和宽敞舒适的卡座沙发，车内贴上十多万粒Swarovski水晶装饰，是由外国贴石专家团队精心镶贴！参与这个为游客量身订做的观光巴士体验，你会更加深入了解香港的文化，美食和景点。水晶巴士设计装潢舒适，设有空调、餐椅、音响以及不同种类的棋牌游戏和电子设备，还设有五国语言旁白介绍，行程中会提供中式点心作为餐饮美食，用心制作，保留了香港风味，让你能一次品尝款款精致的菜式。乘坐水晶巴士游历繁华的闹市，深入感受香港的生活。下午团餐是经过精挑细选，秉承用心製作，保留香港风味的餐厅“一点心”，曾荣获米之莲评荐。米之莲点心，务求客人能一次品尝款款精致的菜式。在客人享用美食的同时，水晶巴士更会游历繁华的闹市感受香港的生活，利用短短的2.5小时行程以快捷的方法了解香港风土人情及名胜古迹。,https://dimg04.c-ctrip.com/images/0100j12000f6so9o9E62A.png
香港,HELISERVICES直升机游香港,2480866,22.292378,114.176765,4.3,要论游香港方式，首推直升机之旅，专业的飞行员带你上天，从另一个角度尽情欣赏香港风光。飞行的总时长从18分钟至60分钟不等，登机地点包括半岛酒店顶楼和金紫荆广场，堪称高端大气上档次。行程线路也有多种可选。香港岛之旅可以环香港岛沿岸，饱览繁华的维多利亚港和港岛南区景致优美的沙滩海岸；九龙半岛及香港岛之旅还可以另外欣赏到九龙半岛的弥顿道两侧的热闹景象；香港世界地质公园之旅从九龙出发，一路往北，来到风光秀丽的西贡，从空中俯瞰湛蓝的海面和星罗棋布的岛屿；时间较长的香港全境之旅还会覆盖到大屿山，可谓一次看完整个香港。,https://dimg04.c-ctrip.com/images/0106q12000f6qzxv5F660.jpg
香港,E Cube Club智游天地,1710972,22.317803,114.21504,4.3,Play House E Cube Club 位于 MegaBox 商场 L12-1，占地面积近11000平方尺，是全室内海景儿童游乐场。场内分为十个区域，包括Ming & Friends 迷你剧场、Ming & Friends 游世界迷宫、时空候机店入口、魔幻小食亭、热火赛车场、小人国花园、高球训练馆、浪漫公主馆等，较适合7-8岁儿童游玩。,https://dimg04.c-ctrip.com/images/0103312000bd0lrij1B1E.jpg
香港,香港故事馆,62000716,22.271228,114.179062,4.5,该故事馆位于蓝屋湾仔石水渠街，前身为湾仔民间生活馆，不定期举办不同的文化艺术活动，曾经举办过“摊开嚟讲”、“蓝屋放映”及“黄昏音乐”等艺文活动，该故事馆展现的是普罗大众的生活形态，在这里可以看到很多当地以前的生活文物，包括旧式的保温壶、黑胶碟、打字机、展板等，都是有心人或街坊的捐赠。,https://dimg04.c-ctrip.com/images/0106612000bbm6prh889A.jpg
香港,青衣东北公园,61999622,22.359849,114.104191,4.5,青衣东北公园位于青衣岛担杆山路，占地约5.6公顷，公园沿青衣北岸而建，这里环境优美，空气清新，是市民休闲散步的好地方。,https://dimg04.c-ctrip.com/images/1me0512000aoase7cC129.jpg
香港,立法会综合大楼,113182,22.278441,114.171347,4.4,终审法院大楼，又称前立法会大楼，于1912年建成，建筑风格呈现新古典主义，揉合了远东的建筑特色。大楼在落成之初，昔日所有的重要聆讯都是在这里进行。大楼曾经在1985至2011年期间成为立法会大楼，2012年又改为终审法院。楼顶女神雕塑是港剧中高出镜率的地点之一。,https://dimg04.c-ctrip.com/images/100613000000tvuwq629E.jpg
香港,大馆(前中区警署建筑群),1416016,22.278461,114.159034,4.6,大馆位于香港中环荷李活道，建筑群内有旧中区警署、前中央裁判司署及域多利监狱三处古迹。中区警署建于1864年，是一座原三层高的古典式建筑。2005年12月20日，警队举行告别仪式，正式将中区警署上交。原址毗邻同样拥有悠久历史的前中央裁判司署及域多利监狱，拟发展为一个历史文化旅游区。2011年4月，香港赛马会表示，已经完成该区域的考古勘察工作，并且发现了一些相信是晚清至20世纪初的古物，包括容器、陶制烟斗、铜币、瓷碗碎片、疑似隧道建筑以及地基遗骸。大馆如今是一所古迹和艺术馆，致力于为香港带来丰富精彩的历史文物及艺术体验。,https://dimg04.c-ctrip.com/images/100p0z000000mheq618FC.jpg
香港,迷离庄园,1832530,22.307242,114.04604,4.7,一个全球独有的主题园区。还原故事，和小猴子一起去探险，经历一场奇幻景象。庄园的外观就像城堡一样，里面不需要排队，可以全方位参观，故事背景是由音乐盒打开的那刻开始，坐上小火车，昏暗的灯光，效果和机关做得很逼真，体验感不错，剧场表演非常地生动，舞台效果也很好。,https://dimg04.c-ctrip.com/images/0103212000f6qmz8l6F0D.jpg
香港,太平山獅子亭,132484,22.268241,114.155808,4.6,在太平山顶凌霄阁一侧，是观赏维多利亚港两岸及高楼大厦的尚佳位置之一，尤其夜间可遥望维港璀璨灯光。抵达山顶后，沿芬梨径便可到达狮子亭。,https://dimg04.c-ctrip.com/images/10051d000001ej1ko8A62.jpg
香港,九龙清真寺,64637,22.296019,114.176718,4.3,九龙寺庙为3层楼房建筑，寺两旁矗立着对称的望月楼，该寺的底层为大礼堂，内设图书馆、会议室及青年文化进修中心；二楼为礼拜殿，可容纳近千人礼拜；三楼为妇女礼拜殿。,https://dimg04.c-ctrip.com/images/0101k12000bam0x7t9A1E.jpg
香港,洪圣爷湾泳滩,132491,22.216128,114.124724,3.9,洪圣爷湾泳滩是南丫岛远足必经之地，白色沙滩平缓洁净，游乐设施完善，是冲浪爱好者的天堂，附近有不少烧烤的场地，也有多处海岸适宜垂钓。,https://dimg04.c-ctrip.com/images/0102t120008c2auq986C3.jpg
香港,尖东,1711603,22.297093,114.183808,4.3,尖东位于尖沙咀东部，是一个有趣的商业娱乐区。日间以商业、办公室及旅游活动为主，晚间则以酒吧、卡拉OK等场所较为热闹。这里离维港、星光大道和海港城都很近，还可以乘坐天星小轮过海，无论是购物或是旅游都很方便。,https://dimg04.c-ctrip.com/images/0106i12000f6txuyr6F6A.jpg
香港,孙中山纪念馆,137757,22.279326,114.155917,4.3,,https://dimg04.c-ctrip.com/images/0103j12000f6sf2sf04B9.jpg
香港,泰山树屋,1833874,22.308601,114.046817,4.5,泰山树屋位于迪士尼乐园里的一个小岛上，乘木伐就可以到达小岛。树屋里有夸张有趣的面具、古朴的木雕，还有非洲原始乐器。,https://dimg04.c-ctrip.com/images/0107312000bbjh313DB90.jpg
香港,礼宾府,50670,22.275964,114.162453,4.7,香港礼宾府，前称香港总督府，是香港特区用来接待来宾的场所，一些重要典礼亦于这里举办。香港礼宾府的建筑设计糅合了东西文化精髓，大楼既有新古典主义建筑的典雅风格，亦富热带建筑格调。香港礼宾府的花园和小庭园中有各种不同的花卉及树木，当中包括红花杜鹃茶、巴西野牡丹、锦绣杜鹃、大红花、锦葵、金雀花、蝴蝶兰等十几种植物。香港礼宾府每年均会举办开放日予市民免费入会参观园中花卉。,https://dimg04.c-ctrip.com/images/fd/tg/g4/M09/0C/E4/CggYHlaOEUyAQwP4ACoyFEuNhc8909.jpg
香港,油麻地天后庙,64688,22.307197,114.175516,4.2,油麻地天后庙位于油麻地庙街近众坊街一带，是“庙街”这个街名的起源，庙中保留的历史文物极为丰富，为香港二级历史建筑。油麻地天后庙以天后庙正殿为中，两侧则建有油麻地观音楼、油麻地城隍庙、油麻地观音楼社坛及油麻地书院，各座建筑主祀不同的神灵。,https://dimg04.c-ctrip.com/images/0100o12000f6qwdh40D95.jpg
香港,榕树湾大街,1411231,22.222045,114.116404,3.8,榕树湾大街上有很多异域风情的小餐馆、酒吧和特色的工艺品店铺，品尝美食的同时，人们还可以欣赏美丽的海景。,https://dimg04.c-ctrip.com/images/0103q12000bcb7bbz6F54.jpg
香港,旧湾仔邮政局,48292,22.271576,114.178254,4.9,旧湾仔邮政局坐落于湾仔峡道和皇后大道东交界，是现存历史悠久的邮政局建筑。建于1912至1913年间，1915年正式开放为湾仔邮政局。这一座简单的金字顶、曲尺形建筑，山墙及灰塑甚具特色。现由环境保护署用作环境资源中心。内部至今保留着当时的办事柜台、邮政信箱及邮票贩卖机等特色遗产，墙上还挂有湾仔邮政局旧时运作的相片。,https://dimg04.c-ctrip.com/images/100t0d0000006u3wv0B80.jpg
香港,东湾,26306,22.347616,114.06661,4.3,该景点位于新界长洲东岸，沙滩长而窄，行步全程约需15分钟，是当地备受泳客欢迎的海浴胜地。,https://dimg04.c-ctrip.com/images/0104o12000bbgz84xF5CC.jpg
