city,名称,id,纬度,经度,评价分数,介绍,封面图片
香港,荷李活道,50644,22.283352,114.152702,4.3,荷李活道位于香港中环至上环，是香港开埠后兴建的第一条街道。“荷李活道”的名字与美国电影业的好莱坞无关，却来自早年荷李活道一带的冬青树Hollywood。荷李活道东端连接着兰桂坊，而旧中区警署(前香港警察总部)亦位于此街上，而在旧中区警署侧中央广场的Dragon-i酒吧，曾吸引多位足球明星访港时到此消遣。,https://dimg04.c-ctrip.com/images/01A5y120006q6oy55D3E2.jpg
香港,大鸿辉中心,2334991,22.367394,114.121909,4.0,,https://dimg04.c-ctrip.com/images/0104512000cprvt8rED41.jpg
香港,淘大商场,2090287,22.321922,114.220963,4.0,,https://dimg04.c-ctrip.com/images/100nhk133x7kyvqa88D73.jpg
香港,香港海洋公园,3339,22.243923,114.180674,4.6,· 潜入前所未见的深海世界，探索不同主题园区· 拜访人见人爱的大熊猫明星，与来自极地的朋友企鹅会面，全方位感受小动物· 挑战动感天地的机动游戏，享受速度带来的快乐位于香港岛南面的香港海洋公园丨Ocean Park Hong Kong，是全球非常受欢迎的主题公园之一，占地170英亩，建筑分布于南朗山上及黄竹坑谷地。海洋公园园内分为高峰乐园和海滨乐园两个区域，设有8个不同主题的天地，包括亚洲动物天地、梦幻水都、威威天地、热带雨林天地、动感天地、海洋天地、急流天地及冰极天地。高峰乐园△ 以游乐场嘉年华为主，更适合追求刺激的大朋友。不论是“海洋天地”的过山车、摇摆船、跳楼机，或是“急流天地”和“动感天地”的滑浪飞船、越矿飞车、翻天覆地等，一定都让你心跳爆表、尖叫连连。亚洲动物天地△ 为全世界前列拥有户内外兼容的展馆之园区，园区内展出各种来自亚洲不同地区动物。香港赛马会四川奇珍馆-前身为香港赛马会大熊猫园，于1999年开幕，成为大熊猫安安和佳佳的居所。于2012年改建成香港赛马会四川奇珍馆，并加入由四川借出的两只保护动物川金丝猴乐乐和虎虎。水母万花筒△ 于2006年4月10日揭幕，为全亚洲巨型的独立水母馆。梦幻水都△ 海洋奇观-名列世界十大水族馆之一，是全球第9大的水族馆。馆内更设直径达5.5米的观赏圆顶，让游客探视水底世界。游客亦能到达高8米、阔13米的巨型观赏屏，一次过目睹馆内所有鱼类。双龙奇缘，位于人工湖内，为全球首座360度的全景水幕，喷泉使用大量直上喷泉造成大水幕，大水幕外设有水火相容喷泉。园区内主要交通工具1. 登山缆车：登山缆车沿着以一道全长1.5公里的架空钢索连接山上及山下，旅客可以在沿途欣赏香港岛南区以及南海的辽阔景致。2. 登山电梯：登山电梯于1987年启用，连接南朗山（海洋天地）与大树湾（急流天地）2个区域。总长度达225米，是全世界第二长的户外扶手电梯系统。登山电梯不受天气影响。3. 海洋列车：欢迎乘坐海洋公园的海洋列车，展开一段精彩刺激的深海历险旅程，极速往返山上的高峰乐园与山下的海滨乐园。,https://dimg04.c-ctrip.com/images/1lo2q12000lnd8e2t50CD.jpg
香港,香港迪士尼乐园,22943,22.310238,114.046361,4.7,"冰雪奇缘世界已于香港迪斯尼乐园正式开幕""For the First Time in Forever""，宾客可以置身在壮阔的《冰雪奇缘》电影世界，让一个个熟悉的电影场景，现在都成为你眼前的风景！冰雪奇缘世界 — 身历奇境 LET IT GO!期待已久的宾客终于可以到阿伦黛尔王国游览，除了登上小木船探索魔雪奇幻之旅，及在雪岭滑雪橇上展开一趟刺激的旅程，更可以与安娜和爱莎到森林小天地一起游玩互动。别错过品尝传统菜式和搜罗拥有文化特色的纪念手信。让你从早到晚都全情投入在奇妙体验！城堡汇演，闪亮夜空多媒体夜间城堡汇演 —「迪士尼星梦光影之旅」点亮晚空。长约20分钟的多媒体光影汇演，以迪士尼经典故事与注入全新编排的经典乐章，带领宾客细味触动心灵的生命旅程。奇妙梦想城堡 象征勇气、希望和无尽可能的奇妙梦想城堡，是香港迪斯尼乐园的全新地标。城堡设计灵感来自13个有关经典迪斯尼公主和女王的故事，标志每颗永不放弃追求梦想的决心。Duffy与好友同萌游 Duffy与好友纷纷换上缤纷多彩的节日服饰，和你共度充满欢笑的时光，一起摸摸草，闻闻花，蹦蹦跳跳，去到哪里，就玩到哪里！因为在Duffy与好友的世界里，每个人都可以随心做回纯真的自己，游心而玩！不容错过的漫威主题体验喜爱漫威的你快登上「铁甲奇侠飞行之旅」以及「蚁侠与黄蜂女：击战特攻！」与超级英雄们连手，共同抵御邪恶势力！尽享购物美食的无限乐趣 度假区独有的迪士尼造型美食，满载奇思妙想，款款令人大饱眼福与口福，回味无穷；另外，更可把乐园商店内多个不同系列精品带回家中延续奇妙！延续奇妙旅程无论和家人欢度假期、与挚爱甜蜜庆祝、还是跟闺密好友开心相聚，入住香港迪斯尼乐园度假区，三间酒店不一样的主题，一样奇妙，将乐园的奇妙体验无限延续，圆满你的奇妙旅程。适用于迪士尼设计、·标志及产物：©Disney ©2024 MARVEL数据源：香港迪士尼乐园官方网站",https://dimg04.c-ctrip.com/images/1lo1u12000k60t9gy7523.jpg
香港,尖沙咀,56109,22.296067,114.177138,4.7,尖沙咀位于九龙半岛南端，面临维多利亚港，与香港岛中环隔海相望。这里有香港知名的景点——无论是明星手印扎堆的星光大道，还是景色宜人的维多利亚港，抑或是《重庆森林》取景地重庆大厦，或者供游人休息放松的九龙公园，都是游客来尖沙咀打卡的景点。尖沙咀是知名的商业区，坐拥DFS免税店、海港城、SOGO等大型购物点，也有LV、Prada、Dior等国际一线品牌专卖店，交织出令您怦然心动的血拼地图！1881 Heritage是集合历史古迹与时尚品牌商店，给您穿越古今的购物体验。与广东道仅有数街之遥的弥敦道，商店、酒店、餐馆、夜店闪着五光十色的霓虹灯，炫目华丽。逛累了，到邻近港铁尖东站的尖沙咀中心及帝国中心，在香港知名的露天茶座 Alfresco Lane 坐下来，欣赏维港迷人景色，品尝国际美食，满血复活再逛一圈！这里还有香港历史博物馆、香港科学馆、香港太空馆及香港文化中心等文化场所，设施先进，寓教于乐，是亲子游的好选择。,https://dimg04.c-ctrip.com/images/010621200087cdcm69311.jpg
香港,太平山顶,3307,22.273192,114.150563,4.5,今个盛夏，山顶缆车及凌霄阁将由2025年6月26日起至12月31日呈献迪士尼「Mickey Keep It Real」主题活动，将太平山顶打造成充满惊喜的盛夏庆典！人气角色米奇、米妮、唐老鸭、黛丝、高飞、布鲁托、钢牙与大鼻，将于中环山顶缆车总站出发，与所有Disney fans展开一场横跨整个太平山顶的精彩旅程！赶紧约定挚爱好友于今个暑假一同体验Magic-cool时刻，乐在当「夏」！ 带领大家畅玩10大主题打卡区， 参与AR数码寻宝游戏解锁惊喜奖赏及把握机会到山顶「Mickey Keep It Real」期间限定店带走限定主题精品 ! 无需额外支付入场费用－只需购买包含凌霄阁摩天台428的优惠套票（来回或单程），即可让宾客沉浸在奇幻体验中。千万不要错过这次的独特机会。香港港岛太平山顶是为香港岛高峰，因视野开阔，既可远眺大屿山，俯瞰香港全景，又可见层层叠叠的摩天高楼和维多利亚海港夜景，再结合山顶凌霄阁观光台以及山顶缆车，成为香港一处重要的旅游景点，是香港的标志性景点之一。△ 搭乘山顶缆车是了解香港的方式，每年有数百万旅客以壮观的角度欣赏都市景致和大自然风光。﻿△ 凌霄阁摩天台428是香港的360度观景台，无论白天、黄昏或夜晚，都可以为您提供目不暇给的视觉体验，让您尽享都市景致和独特魅力。△ 趣味时光留影馆位于山顶凌霄阁2楼，展出了22个精心设计的主题场景，引入影楼式专业照明和多种元素，让您以自拍的形式体验大型自拍体验馆。△ 香港杜莎夫人蜡像馆集合了超百尊全球名人蜡像，也提供多感官展示，包括首创的香港人气唱作人王嘉尔的扩增现实全像影像体验。△ 大富翁梦想世界位于香港太平山顶，将桌上游戏的经典元素立体呈现，让每个人都能成为大富翁，欢迎前来梦想世界。,https://dimg04.c-ctrip.com/images/100f0z000000ncfisF674.jpg
香港,中环,56110,22.277275,114.163796,4.7,中环位于香港的中西区，是香港政治及商业中心，很多银行、跨国金融机构及外国领事馆都设在此。香港政府总部，立法会大楼，以及前港督府（现称礼宾府）也坐落于此。中环的景观是老建筑与现代高科技大厦的混合体，老建筑如立法会大楼，现代建筑如中银大厦、IFC国际金融中心等已成为香港标志性景点，构成香港岛美丽和壮观的城市风景线。中环沿山脚而上向山顶发展，很多街道要爬坡或爬楼梯，如石板街，还有无数次出现在TVB电视剧中的煤气灯街，这里知名的景点是太平山顶，还有那知名的有盖扶手电梯——中环至半山自动扶梯。另外，香港夜生活的好地——兰桂坊也位于中环云咸街与德己立街之间一条短小、狭窄、呈L形并用鹅卵石铺成的街巷中。中环聚集了许多大型购物商场，置地广场、历山大厦、遮打大厦及太子大厦组成了知名购物圈，知名餐厅也不胜枚举，多家知名米其林餐厅外，九记牛腩、兰芳园、镛记酒家、莲香楼都是值得推荐的美味，人气也很旺，要做好排队的准备。,https://dimg04.c-ctrip.com/images/0104f12000862sp0h4CD8.jpg
香港,维多利亚港,55194,22.29814,114.171939,4.6,• 迷人海景和夜景，成为游客来港必到之地• 乘搭游船，以与众不同的角度欣赏维港景色• 还可以在美丽夜景当中欣赏大型灯光音乐汇演△ 入夜后万家灯火，相互辉映，维港夜景因而与函馆、那不勒斯并列“世界三大夜景”。△ 维多利亚港每晚8点上演的大型灯光汇演“幻彩咏香江”值得期待，40余栋大楼配合着充满节奏感的音乐，发出缤纷跃动的灯光令人目眩神迷。南岸香港岛有充满现代感的知名高楼大厦——中银大厦、国金中心，香港会议展览中心，这些都是TVB电视剧的常客。北岸九龙则有星光大道、天星码头，这里也是观赏维港景致和“幻彩咏香江”的好位置。若想更好的欣赏维港，可以参加维港海上游观光团，登上观光船或者中式帆船，置身海港中央，以全新角度感受香港的活力和动感，感受维港的美。△ 每逢元旦前夜和农历年初二晚上，维港都会举行盛大的烟花表演，两岸的高楼也会参与其中，将夜空装点的格外耀眼，近年更吸引数十万名香港及内地民众，聚集在维多利亚港两岸庆祝新年的来临。,https://dimg04.c-ctrip.com/images/10020y000000m5j4vCC02.jpg
香港,星光大道,26244,22.290257,114.179109,4.7,星光大道全长400多米，大道上李小龙的铜像高2米，此外，这里还有拍摄现场的雕像，你也可以坐在中间的椅子上做一回导演，指挥灯光师和收音师。漫步在星光大道上，吹着海风，人们可以欣赏维港对岸的美丽夜景。,https://dimg04.c-ctrip.com/images/100u12000000rm8qm4899.jpg
香港,大屿山,64613,22.263516,113.946613,4.7,大屿山是香港大的岛屿，面积相当于两个香港岛。无论是购物休闲、登山亲水、渔村风情、禅寺梵音、梦幻乐园，统统都可以在这里找到，这里的游客知名度在近年不断提升。昂坪禅寺大佛从东涌可以搭乘昂坪360缆车，25分钟即可抵达昂坪，“水晶车厢”底面和四壁一样是透明的，更添刺激。昂坪有着堪称大屿山象征的天坛大佛和宝莲禅寺。天坛大佛高34米，面部参照龙门石窟的卢舍那佛，宝相庄严，是全球第二大户外青铜坐佛像。百年古刹宝莲禅寺，素有南天佛国之称，多年来香火鼎盛，寺内有多座富中国特色的建筑值得参观，还可以在此享用佛门斋菜。从宝莲禅及天坛大佛出来后可以步入心经简林，这是一个由38条木柱组成的大型户外木刻群，沿途还可以观赏到中国南海的景色，翠绿禅境，特别容易感到祥和平静。大澳渔村风情大澳是大屿山上早开发的渔村，有“香港威尼斯”之称。建于水上的高脚棚屋是大澳特色，密密麻麻的棚屋、纵横交错的水道与桥梁，构成大澳现今的面貌。在这里可以乘船出海寻找中华白海豚，品尝新鲜的海鲜美食，得宜的土产莫过于咸鱼、海味、虾膏、虾酱、花胶等，都是旅客必定选购的手信。时间充裕的话，不妨在旧警署改建的大澳文物酒店住一晚，享受宁静。户外和海上运动香港第二高峰凤凰山是观看日出的知名去处，山上设有专门的远足径，凤凰径，非常受户外登山爱好者的青睐。如果要观看日出，请务必带好手电筒并注意安全哦。喜欢日光浴和冲浪等海上运动的游客，不能错过贝澳泳滩和长沙湾海水浴场，长沙湾有香港长的沙滩，沙质细腻、海水清澈、设施齐全。香港迪士尼乐园踏进香港迪士尼乐园，你会发现童话故事一一实现，童话人物真的来到你面前，你可以欣赏百老汇式精彩表演，或畅玩乐趣无穷的动感机动游戏，享受一整天的开心精彩，感受迪士尼故事的魅力！七大主题园区：美国小镇大街、幻想世界、明日世界、探险世界、反斗奇兵大本营、灰熊山谷、迷离庄园，无论大朋友还是小朋友都会尽兴而归。东荟城Outlet东荟城名店仓是香港面积大的品牌outlet之一，聚集了近90个品牌的时装、配饰、美妆、家居、运动产品，价格常年在3-7折，是寻宝的好去处。除购物之外，还有水疗spa、电影院和多国美食可以享用。,https://dimg04.c-ctrip.com/images/010681200087c7n6pA2FC.jpg
香港,香港杜莎夫人蜡像馆,43906,22.2685,114.154759,4.5,"新世代男神Timothée Chalamet「甜茶」亚洲⾸尊蜡像惊喜登场重现⾸映红毯时尚香港杜莎夫⼈蜡像馆，将迎来亚洲⾸尊新世代男神Timothée Chalamet蜡像，为影迷及游客带来「甜茶」的甜蜜惊喜!由即⽇起，这位以精致外貌、细腻演技及独特时尚⽽风靡全球的新⽣代明星，将以不朽的蜡像造型亮相「魅⼒香江」展区，重现他出席电影⾸映的经典造型。他将与其他国际名⼈同场展出，与你近距离同框打卡，让你成为社交媒体上的话题⼈气王！Chris Hemsworth 置身打卡装置 体验男神反转魅力另一尊蜡像来自澳洲的型男演员 Chris Hemsworth，是次一改电影中摩登型格造型，以一袭粉蓝色套装亮相，展现浪漫男神魅力。 简约造型完美呈现 Chris Hemsworth 的阳光、悠闲惬意风格，为配合其蜡像风格，是次更为他打造与别不同的背景装置——色彩缤纷的特色仿花打卡墙，制造充满活力且动人浪漫的氛围，令人无法抗拒。一众影迷能够在馆内「魅力香江」展区跟男神打卡见面。知名环球小姐 Catriona Gray正式进驻香港杜莎夫人蜡像馆香港杜莎夫人蜡像馆一向致力推广国际旅游业，今日正式宣布馆内即将迎来新一位选美界耀眼新星——2018 环球小姐冠军特丽安娜·格雷(Catriona Gray)，诚邀来自世界各地的宾客前来感受沉浸式的蜡像互动体验。她是继环球小姐皮娅·武茨巴赫 (Pia Wurtzbach) 以及世界拳击冠军曼尼 · 帕奎奥 (Manny Pacquiao)后 ，第三位获邀进驻的菲律宾籍名人。场馆介绍准备化身Superstar！香港杜莎夫人蜡像馆是您毕生梦寐以求的派对，与众不同、星光熠熠！蜡像馆设有非凡的沉浸式互动体验，是一个能让您同时接触荷里活明星及心仪亚洲名人、音乐天, 王、体坛健将等的地方！在精彩梦幻、明星荟萃的「时尚专区」扩增实境（AR）体验下走时装秀，展露您时尚型格的一面！感受首创的人气歌手王嘉尔AR合照及全息演唱会体验！在「动漫游戏世界」与您喜欢的英雄人物和人气角色如Hello Kitty等尽情玩乐！与您心爱的K-POP韩星及韩国名人在我们大型的「韩流专区」作近距离互动！游玩攻略与明星互动的全息影像及扩增实境（AR）体验！感受以互动科技打造的体验，与您喜爱的国际巨, 星如王嘉尔、罗拔柏迪臣（Robert Pattinson）及波里活巨, 星瓦伦·达瓦（Varun Dhawan）等近距离亲密互动！乐坛巨, 星：踏入全新乐坛巨, 星专区，创意互动立即震撼你的感官体验，与邓紫棋于录音室内尽情高歌，或是与米高·积逊表演月球漫步AR共舞！时尚专区：在精彩梦幻、星光熠熠的AR体验下走时装秀，展露您时尚型格的一面！韩流专区：与您心爱的韩星及韩国名人打造难忘追星时刻！",https://dimg04.c-ctrip.com/images/1lo4d12000htjvlb9F01A.jpg
香港,荃湾,1408057,22.367238,114.11953,4.6,荃湾位于香港新界西南，有许多值得探访的历史古迹，在荃湾古老步道漫步、探索历史久远的庙宇，或在传统茶楼品茗、用餐，都是回味老香港的不错选择。荃湾开始称为浅湾，因地处滩边且水浅得名。川龙村是荃湾较老的村落之一，位于香港较高的山岭——大帽山山麓。那里有条清澈的小溪，灌溉附近的果园和农田，川龙村也就沿著水岸发展起来，今日村内仍可见耕地。川龙村有几家有名的茶楼，包括彩龙茶楼、端记茶楼等。具有200年历史的客家围村—三栋屋博物馆就在荃湾地铁站附近，这个围村在1981年被列为法定古迹，是由来自广东的陈氏家族于1786年兴建而成。陈氏家族开始在荃湾海滨定居时，只建有三排房屋，后来族人再建造祠堂，并扩建其他建筑物，至今保存得很完整。荃湾另一处探寻旧日农村面貌的地方，就是元荃古道郊游径。这是从前荃湾和元朗两地进行贸易的路径，这条步道全长12.5公里，贯穿大榄郊野公园，在山顶可以俯瞰荃湾和九龙的迷人景色，还有闻名全球的青马大桥，横跨马湾海峡，全球较长可供车辆、地铁行驶的两用吊桥。,https://dimg04.c-ctrip.com/images/100g12000000si644F121.jpg
香港,南丫岛,52675,22.197354,114.140068,4.7,南丫岛的主要景点有榕树湾、洪圣爷湾、索罟湾和深湾，其中，榕树湾上有较大的村落，还有各种创意小店和餐厅，吸引了很多游客前来游玩，在索罟湾，人们可以了解当地的渔民文化。,https://dimg04.c-ctrip.com/images/100n1f000001gpakxEA07.jpg
香港,东涌,21594,22.284086,113.948456,4.3,东涌，古称东涌口，位于大屿山北岸中间位置，一面临海，三面环山。东涌有着悠久的文化，历史遗迹较多，有一座用以堵截海盗侵略城池的东涌炮台，现仍遗有6枚清朝古炮。东涌以北的赤腊角便是新机场的所在，在东涌炮台可清晰远眺。沿炮台右边的小径走，可到达候王庙，庙宇用以供奉与宋末君主一同牺牲的宁相杨候王。,https://dimg04.c-ctrip.com/images/0103s12000f6qvsnwB02B.jpg
香港,昂坪360,26277,22.253301,113.906268,4.7,· 乘坐昂坪缆车，前往天坛大佛、宝莲寺、大澳渔村等香港知名旅游景点，展开你的大屿山探索之旅！· 坐在舒适宁静的车厢内，一览香港国际机场、大屿山的山光水色、天坛大佛及昂坪高原360度全景· 畅游昂坪市集，尽享各式精彩娱乐设施！昂坪缆车旅程，连接东涌至昂坪，饱览香港大屿山的优美景致。缆车一到达就是昂坪市集，也是前往天坛大佛、宝莲禅寺、大澳渔村等香港景点的上佳方法。昂坪市集集休闲、购物、和四大主题景点于一身，是旅客及本地人假日游的人气热点！市集内设有「360动感影院」、「缆车探知馆」等主题景点，也提供各色美馔佳肴，可享受多姿多采的消闲、餐饮及购物体验。昂坪360缆车△ 昂坪缆车分别有标准车厢、水晶车厢或全景车厢可供选择。每程缆车车程约25分钟，你可以根据行程选择单程或来回缆车。△ 全景车厢昂坪市集△ 位于香港大屿山的昂坪市集占地1.5公顷，毗邻昂坪缆车站、天坛大佛及宝莲禅寺，市集内富有中国文化特色的建筑及园林设计与昂坪独有的大自然景致互相融合。提供多姿多采的消闲、餐饮及购物体验，是来香港自由行的必到景点。,https://dimg04.c-ctrip.com/images/0101312000f6t3hbr9D02.jpg
香港,山顶缆车,113164,22.274967,114.164188,4.5,今个盛夏，山顶缆车及凌霄阁将由2025年6月26日起至12月31日呈献迪士尼「Mickey Keep It Real」主题活动，将太平山顶打造成充满惊喜的盛夏庆典！人气角色米奇、米妮、唐老鸭、黛丝、高飞、布鲁托、钢牙与大鼻，将于中环山顶缆车总站出发，与所有Disney fans展开一场横跨整个太平山顶的精彩旅程！赶紧约定挚爱好友于今个暑假一同体验Magic-cool时刻，乐在当「夏」！ 带领大家畅玩10大主题打卡区， 参与AR数码寻宝游戏解锁惊喜奖赏及把握机会到山顶「Mickey Keep It Real」期间限定店带走限定主题精品 ! 无需额外支付入场费用－只需购买包含凌霄阁摩天台428的优惠套票（来回或单程），即可让宾客沉浸在奇幻体验中。千万不要错过这次的独特机会。• 搭乘山顶缆车之太平山顶，欣赏全方位的辽阔景色• 搭乘缆车，目睹摩天大厦倾倒的神奇错觉现象• 前往凌霄阁摩天台428，360度全景俯瞰香港景色△ 山顶缆车有100多年历史，是通向香港太平山顶的主要交通工具，7分钟便可从山脚缓缓升至山顶。△ 缆车整个车厢几乎呈45度倾斜攀升，轨道两边是坐落在林木之间幢幢住宅，缆车一路沿著陡坡前行，令你身子不由得后倾，是十分难得的体验。,https://dimg04.c-ctrip.com/images/01074120009v1yq1h3BA9.jpg
香港,兰桂坊,48810,22.278275,114.16066,4.5,兰桂坊，香港夜生活的殿堂地，是中环德己立街及云咸街之间一带的小巷弄，呈L形，用鹅卵石铺成，街巷边满布90多家餐厅酒吧，提供日本、印度、意大利、墨西哥、法国、美国、中东等地的美食，深受白领、外籍人士及游客的欢迎，名气很大。酒吧一条街上插满了各国的国旗。兰桂坊的魅力是夜生活，过了晚上11点前往，这里人头攒动。很多人拿着啤酒站在路上，非常热闹。此外，每周四晚上都是LadiesNight，女生来的话是免入场费的，每一家都是，到里面还有一杯免费的威士忌赠送，而此时，男生的入场费会相对贵一些。每逢万圣节、圣诞节、元旦或“兰桂坊啤酒节”，兰桂坊街头更会有一场场色彩缤纷的嘉年华会，满载美酒美食，成为城中令人瞩目的节庆焦点之一，要感受西方节日的气氛，兰桂坊肯定是理想目的地。,https://dimg04.c-ctrip.com/images/0103612000h4rvuk21B2A.jpg
香港,浅水湾,3310,22.231735,114.200102,4.6,浅水湾依山傍海，海湾呈新月形，在浅水湾，人们可以游泳、散步，海滩上的镇海楼公园内，矗立着十多米高的天后娘娘、观音菩萨及长寿桥等；在海滩另一侧有一条丽海堤岸路，沿路可抵深水湾。,https://dimg04.c-ctrip.com/images/100g0p000000fop3l7AE9.jpg
香港,天星小轮,113165,22.291236,114.173441,4.5,• 被誉为香港的标志之一，屡获不同机构及国际媒体颁发奖项以表扬其独特的风格和体验• 不单是香港与九龙之间的渡海交通运输系统的重要组成部分，亦是访港旅客必会体验的行程•《国家地理旅游杂志》曾把乘搭天星小轮游览维港两岸誉为「人生五十个必到景点」之一△ 直至今日，天星小轮依旧保持着复古造型，船舱内的木质长椅、铁质风扇，很有老香港的味道。△ 目前天星小轮共有2条轮渡航线，停靠3个码头，分别是尖沙咀-中环线、尖沙咀-湾仔线，其中尖沙咀-湾仔线更适合欣赏维港夜景。,https://dimg04.c-ctrip.com/images/fd/tg/g6/M0B/F1/03/CggYslcfBhWAQ_K4ABJwQC-4_cA735.jpg
